{
  "prompt": {
    "customerName": "Northstar Medical Logistics",
    "businessDescription": "Coordinates medical equipment delivery, pickup, cleaning status, warehouse movement, and hospital service requests across multiple regions.",
    "applicationNeeds": "Build an internal operations app with dispatch dashboard, service tickets, pickup/delivery workflows, warehouse inventory status, hospital account views, technician task assignments, approvals for urgent replacements, audit logs, role-based access, and reporting.",
    "constraints": {
      "industry": "Healthcare Logistics",
      "compliance": ["Auditability", "Least privilege"],
      "integrations": ["CSV import/export", "Future ERP integration"],
      "roles": ["Dispatch Coordinator", "Warehouse Lead", "Technician"],
      "approvalRequirements": ["Urgent replacement approval", "Inventory disposition approval"],
      "environment": "local-first with promotion to staging and production",
      "deploymentTarget": "internal web",
      "tenancy": "multi-tenant"
    }
  },
  "spec": {
    "schemaVersion": "2026-03-28.spec.v2",
    "generatedAt": "2026-03-28T06:00:00.000Z",
    "compiler": {
      "compilerVersion": "2026-03-28.compiler.v2",
      "specVersion": "2026-03-28.spec.v2",
      "targetRuntime": "generated-runtime-kit.v2",
      "selectedDomainPackKeys": ["core-operations", "healthcare-logistics"],
      "selectedModuleKeys": ["dashboard", "dispatch-board", "approvals"],
      "selectedAdapterKeys": ["design-handoff-adapter", "erp-sync-sdk"],
      "stageResults": [
        { "key": "normalize", "name": "Normalize Prompt", "status": "completed", "summary": "Normalized operator prompt.", "selectedKeys": ["northstar-medical-logistics"], "warnings": [] }
      ]
    },
    "customerProfile": {
      "name": "Northstar Medical Logistics",
      "slug": "northstar-medical-logistics",
      "industry": "Healthcare Logistics",
      "tenancy": "multi-tenant ready with tenant-scoped business entities",
      "branding": {
        "brandName": "Northstar Medical Logistics",
        "primaryColor": "#153f69",
        "secondaryColor": "#5f95aa",
        "accentColor": "#d97a2b",
        "surfaceColor": "#f3f7f8",
        "canvasColor": "#e4edf0",
        "headingFont": "\"Bahnschrift SemiBold\", \"Aptos Display\", sans-serif",
        "bodyFont": "\"Aptos\", \"Segoe UI Variable Text\", sans-serif",
        "density": "balanced",
        "logoTreatment": "Northstar monogram with a compass-star accent"
      }
    },
    "businessDomain": "Healthcare Logistics operations",
    "appPurpose": "Internal operations app for dispatch, service tickets, inventory, approvals, and reporting.",
    "summary": "Northstar Medical Logistics needs an internal enterprise app built from reusable modules, domain packs, and typed contracts.",
    "identityAndAccess": {
      "authStrategy": "Enterprise SSO or local admin bootstrap with later IdP cutover",
      "tenantIsolation": "Tenant-scoped rows, tenant-aware APIs, and no cross-tenant data access by default",
      "leastPrivilegeNotes": ["Approval rights are separated from general operational access"],
      "approvalPolicy": "Irreversible workflow actions require explicit approval plus audit capture"
    },
    "coreWorkflows": [
      {
        "key": "dispatch",
        "name": "Dispatch and Fulfillment",
        "steps": [
          { "key": "intake", "label": "Intake" },
          { "key": "assign", "label": "Assign" }
        ]
      }
    ],
    "businessEntities": [
      {
        "key": "inventory_item",
        "label": "Inventory Item",
        "fields": [
          { "key": "assetTag", "label": "Asset Tag", "type": "string" }
        ]
      }
    ],
    "userRoles": [
      { "key": "platform_admin", "name": "Platform Admin" },
      { "key": "dispatch_coordinator", "name": "Dispatch Coordinator" }
    ],
    "integrations": [
      { "key": "csv_exchange", "name": "CSV Exchange", "mode": "active" },
      { "key": "erp_sync", "name": "ERP Sync", "mode": "future-ready" }
    ],
    "moduleSelections": [
      { "key": "dashboard", "name": "Operations Dashboard", "route": "/dashboard", "kind": "dashboard", "source": "base" }
    ],
    "adapterBindings": [
      { "key": "design-handoff-adapter", "name": "Design Handoff Adapter", "mode": "active", "status": "selected" }
    ],
    "approvalGates": [
      { "key": "urgent-replacement", "name": "Urgent Replacement Approval", "trigger": "Urgent replacement request" }
    ],
    "assumptions": [
      "Generated apps own their own business records."
    ],
    "unresolvedItems": [
      "Select the customer identity provider."
    ],
    "uncertainty": {
      "level": "medium",
      "reasons": ["ERP details remain unresolved."],
      "missingContext": ["Identity provider", "Final branding assets"]
    },
    "blueprint": {
      "layout": "Three-zone operator workspace",
      "routeGroups": ["/dashboard"],
      "reusablePrimitives": ["kpi-ribbon-and-ops-board"],
      "backgroundOperations": ["generation job tracking"],
      "observability": ["file-backed job logs"],
      "persistenceOwnership": "Generated customer apps own their own business records, workflow outcomes, and approval decisions."
    }
  },
  "operator": "Enterprise Operator",
  "focus": ["architecture", "security", "download", "test"],
  "requestedSeatKeys": ["tesla", "marcus", "jobs"],
  "allowDelegation": true,
  "maxDelegationDepth": 3,
  "providerMode": "deterministic"
}
